{
  "name": "Neo Tokyo",
  "id": "neo-tokyo",
  "category": "tech-ai",
  "description": "Cyberpunk-inspired with neon rose and dark backgrounds",
  "colors": {
    "light": {
      "background": "0 0% 100%",
      "foreground": "240 10% 3.9%",
      "primary": "346.8 77.2% 49.8%",
      "primary-foreground": "355.7 100% 97.3%",
      "secondary": "240 4.8% 95.9%",
      "secondary-foreground": "240 5.9% 10%",
      "muted": "240 4.8% 95.9%",
      "muted-foreground": "240 3.8% 46.1%",
      "accent": "240 4.8% 95.9%",
      "accent-foreground": "240 5.9% 10%",
      "destructive": "0 84.2% 60.2%",
      "destructive-foreground": "0 0% 98%",
      "border": "240 5.9% 90%",
      "input": "240 5.9% 90%",
      "ring": "346.8 77.2% 49.8%",
      "card": "0 0% 100%",
      "card-foreground": "240 10% 3.9%",
      "popover": "0 0% 100%",
      "popover-foreground": "240 10% 3.9%",
      "chart-1": "346.8 77.2% 49.8%",
      "chart-2": "280 65% 60%",
      "chart-3": "190 80% 50%",
      "chart-4": "40 90% 60%",
      "chart-5": "120 60% 50%",
      "sidebar-background": "0 0% 98%",
      "sidebar-foreground": "240 5.3% 26.1%",
      "sidebar-primary": "346.8 77.2% 49.8%",
      "sidebar-primary-foreground": "0 0% 98%",
      "sidebar-accent": "240 4.8% 95.9%",
      "sidebar-accent-foreground": "240 5.9% 10%",
      "sidebar-border": "220 13% 91%",
      "sidebar-ring": "346.8 77.2% 49.8%"
    },
    "dark": {
      "background": "240 10% 3.9%",
      "foreground": "0 0% 98%",
      "primary": "346.8 77.2% 49.8%",
      "primary-foreground": "355.7 100% 97.3%",
      "secondary": "240 3.7% 15.9%",
      "secondary-foreground": "0 0% 98%",
      "muted": "240 3.7% 15.9%",
      "muted-foreground": "240 5% 64.9%",
      "accent": "240 3.7% 15.9%",
      "accent-foreground": "0 0% 98%",
      "destructive": "0 62.8% 30.6%",
      "destructive-foreground": "0 0% 98%",
      "border": "240 3.7% 15.9%",
      "input": "240 3.7% 15.9%",
      "ring": "346.8 77.2% 49.8%",
      "card": "240 10% 3.9%",
      "card-foreground": "0 0% 98%",
      "popover": "240 10% 3.9%",
      "popover-foreground": "0 0% 98%",
      "chart-1": "346.8 77.2% 49.8%",
      "chart-2": "280 65% 60%",
      "chart-3": "190 80% 50%",
      "chart-4": "40 90% 60%",
      "chart-5": "120 60% 50%",
      "sidebar-background": "240 5.9% 10%",
      "sidebar-foreground": "240 4.8% 95.9%",
      "sidebar-primary": "346.8 77.2% 49.8%",
      "sidebar-primary-foreground": "0 0% 100%",
      "sidebar-accent": "240 3.7% 15.9%",
      "sidebar-accent-foreground": "240 4.8% 95.9%",
      "sidebar-border": "240 3.7% 15.9%",
      "sidebar-ring": "346.8 77.2% 49.8%"
    }
  },
  "radius": "0.5rem",
  "fontFamily": {
    "sans": "Inter, system-ui, sans-serif",
    "mono": "JetBrains Mono, monospace"
  }
}
