{
  "name": "Mono",
  "id": "mono",
  "category": "minimal-clean",
  "description": "Black and white with single accent like Apple and Vercel docs",
  "colors": {
    "light": {
      "background": "0 0% 100%",
      "foreground": "0 0% 9%",
      "primary": "0 0% 9%",
      "primary-foreground": "0 0% 98%",
      "secondary": "0 0% 96%",
      "secondary-foreground": "0 0% 9%",
      "muted": "0 0% 96%",
      "muted-foreground": "0 0% 45%",
      "accent": "0 84.2% 60.2%",
      "accent-foreground": "0 0% 98%",
      "destructive": "0 84.2% 60.2%",
      "destructive-foreground": "0 0% 98%",
      "border": "0 0% 90%",
      "input": "0 0% 90%",
      "ring": "0 0% 9%",
      "card": "0 0% 100%",
      "card-foreground": "0 0% 9%",
      "popover": "0 0% 100%",
      "popover-foreground": "0 0% 9%",
      "chart-1": "0 0% 9%",
      "chart-2": "0 0% 30%",
      "chart-3": "0 0% 50%",
      "chart-4": "0 0% 70%",
      "chart-5": "0 84.2% 60.2%",
      "sidebar-background": "0 0% 98%",
      "sidebar-foreground": "0 0% 20%",
      "sidebar-primary": "0 0% 9%",
      "sidebar-primary-foreground": "0 0% 98%",
      "sidebar-accent": "0 0% 94%",
      "sidebar-accent-foreground": "0 0% 9%",
      "sidebar-border": "0 0% 90%",
      "sidebar-ring": "0 0% 9%"
    },
    "dark": {
      "background": "0 0% 4%",
      "foreground": "0 0% 98%",
      "primary": "0 0% 98%",
      "primary-foreground": "0 0% 9%",
      "secondary": "0 0% 15%",
      "secondary-foreground": "0 0% 98%",
      "muted": "0 0% 15%",
      "muted-foreground": "0 0% 64%",
      "accent": "0 84.2% 60.2%",
      "accent-foreground": "0 0% 98%",
      "destructive": "0 62.8% 30.6%",
      "destructive-foreground": "0 0% 98%",
      "border": "0 0% 15%",
      "input": "0 0% 15%",
      "ring": "0 0% 83.1%",
      "card": "0 0% 4%",
      "card-foreground": "0 0% 98%",
      "popover": "0 0% 4%",
      "popover-foreground": "0 0% 98%",
      "chart-1": "0 0% 98%",
      "chart-2": "0 0% 75%",
      "chart-3": "0 0% 55%",
      "chart-4": "0 0% 35%",
      "chart-5": "0 84.2% 60.2%",
      "sidebar-background": "0 0% 4%",
      "sidebar-foreground": "0 0% 98%",
      "sidebar-primary": "0 0% 98%",
      "sidebar-primary-foreground": "0 0% 9%",
      "sidebar-accent": "0 0% 15%",
      "sidebar-accent-foreground": "0 0% 98%",
      "sidebar-border": "0 0% 15%",
      "sidebar-ring": "0 0% 83.1%"
    }
  },
  "radius": "0rem",
  "fontFamily": {
    "sans": "Inter, system-ui, sans-serif",
    "mono": "JetBrains Mono, monospace"
  }
}
