{
  "name": "Matrix Green",
  "id": "matrix-green",
  "category": "tech-ai",
  "description": "Hacker and terminal aesthetic inspired by The Matrix",
  "colors": {
    "light": {
      "background": "138 76% 97%",
      "foreground": "142.1 76.2% 5%",
      "primary": "142.1 76.2% 36.3%",
      "primary-foreground": "355.7 100% 97.3%",
      "secondary": "138 50% 93%",
      "secondary-foreground": "142.1 76.2% 10%",
      "muted": "138 50% 93%",
      "muted-foreground": "142 20% 40%",
      "accent": "158.1 64.4% 51.6%",
      "accent-foreground": "142.1 76.2% 10%",
      "destructive": "0 84.2% 60.2%",
      "destructive-foreground": "0 0% 98%",
      "border": "138 30% 85%",
      "input": "138 30% 85%",
      "ring": "142.1 76.2% 36.3%",
      "card": "138 76% 98%",
      "card-foreground": "142.1 76.2% 5%",
      "popover": "138 76% 98%",
      "popover-foreground": "142.1 76.2% 5%",
      "chart-1": "142.1 76.2% 36.3%",
      "chart-2": "158.1 64.4% 51.6%",
      "chart-3": "84.8 85.2% 34.5%",
      "chart-4": "173 58% 39%",
      "chart-5": "120 60% 50%",
      "sidebar-background": "138 76% 95%",
      "sidebar-foreground": "142.1 76.2% 10%",
      "sidebar-primary": "142.1 76.2% 36.3%",
      "sidebar-primary-foreground": "355.7 100% 97.3%",
      "sidebar-accent": "138 50% 90%",
      "sidebar-accent-foreground": "142.1 76.2% 10%",
      "sidebar-border": "138 30% 85%",
      "sidebar-ring": "142.1 76.2% 36.3%"
    },
    "dark": {
      "background": "142.4 70% 3%",
      "foreground": "142.1 76.2% 85%",
      "primary": "142.1 70.6% 45.3%",
      "primary-foreground": "144.9 80.4% 10%",
      "secondary": "142.4 30% 12%",
      "secondary-foreground": "142.1 76.2% 85%",
      "muted": "142.4 30% 12%",
      "muted-foreground": "142.1 50% 55%",
      "accent": "158.1 64.4% 51.6%",
      "accent-foreground": "144.9 80.4% 10%",
      "destructive": "0 62.8% 30.6%",
      "destructive-foreground": "0 0% 98%",
      "border": "142.4 30% 15%",
      "input": "142.4 30% 15%",
      "ring": "142.1 70.6% 45.3%",
      "card": "142.4 70% 5%",
      "card-foreground": "142.1 76.2% 85%",
      "popover": "142.4 70% 3%",
      "popover-foreground": "142.1 76.2% 85%",
      "chart-1": "142.1 70.6% 55.3%",
      "chart-2": "158.1 64.4% 61.6%",
      "chart-3": "84.8 85.2% 44.5%",
      "chart-4": "173 58% 49%",
      "chart-5": "120 60% 60%",
      "sidebar-background": "142.4 70% 3%",
      "sidebar-foreground": "142.1 76.2% 85%",
      "sidebar-primary": "142.1 70.6% 45.3%",
      "sidebar-primary-foreground": "144.9 80.4% 10%",
      "sidebar-accent": "142.4 30% 12%",
      "sidebar-accent-foreground": "142.1 76.2% 85%",
      "sidebar-border": "142.4 30% 15%",
      "sidebar-ring": "142.1 70.6% 45.3%"
    }
  },
  "radius": "0.25rem",
  "fontFamily": {
    "sans": "JetBrains Mono, monospace",
    "mono": "JetBrains Mono, monospace"
  }
}
